{
  "_comment": "Defaults the workbench can override in user://setup.json. config_version 2 is the shipped schema. A saved file with a lower version is upgraded before the codex refresh redraws: a v1 spawns cell list without spawn_rects is grouped into 3x1 border gates. difficulty presets scale spawned wave counts, enemy hp/speed, and kill gold. settlement is the wave-clear vacancy roll. combat is target-lock and path refresh. economy.start_* and wave_clear_* are the match defaults. The map is 20x20, tile 128, origin at the north-west cell, +x east, +y south. spawn_rects are enemy gates. Each rect is {edge, middle, length, width}. edge is north|south|west|east (the outermost row or column). middle is [x, y] of the center cell, which is the cell the user clicked. length is 3 and width is 1. North and south gates run along x and stay on that border row: the width axis points inward and does not step off the border. West and east gates run along y the same way. Corner cells (0,0), (19,0), (0,19) and (19,19) are never a middle. spawns is the derived unique birth-cell list, rebuilt from spawn_rects on load. starter_buildings are {kind, cell} using Building.kind names. starter_units are opening stand positions {unit, cell, sex}. starter_props are extra interior trees and rocks {kind: tree|rock, cell}. The border forest and the four fixed rocks stay generated by the match. roads is painted ground only, a list of [x, y] cells, and is not the enemy movement route. The map keeps exactly one spawn rect. Spawn gates are not tied to road tiles. Setting a spawn does not paint or erase roads. Painted roads only make villagers walk faster.",
  "config_version": 2,
  "difficulty_id": "normal",
  "presets": {
    "easy": { "hp": 0.8, "count": 0.8, "speed": 0.92, "gold": 1.15 },
    "normal": { "hp": 1.0, "count": 1.0, "speed": 1.0, "gold": 1.0 },
    "hard": { "hp": 1.35, "count": 1.15, "speed": 1.08, "gold": 0.85 }
  },
  "settlement": { "chance": 0.65, "max_per_wave": 3 },
  "combat": {
    "target_hold": 1.2,
    "switch_margin": 0.72,
    "repath": 0.6,
    "stuck": 0.9,
    "wander_hold": 2.4,
    "panic_hold": 1.3
  },
  "economy": {
    "start_wood": 100,
    "start_gold": 70,
    "wave_clear_wood": 8,
    "wave_clear_gold": 14
  },
  "spawn_rects": [
    { "edge": "north", "middle": [10, 0], "length": 3, "width": 1 }
  ],
  "spawns": [[9, 0], [10, 0], [11, 0]],
  "roads": [
    [10, 0], [10, 1], [10, 2], [10, 3], [10, 4], [10, 5], [10, 6], [10, 7],
    [10, 8], [10, 9], [10, 10], [10, 11], [10, 12], [10, 13], [10, 14]
  ],
  "starter_buildings": [
    { "kind": "HOUSE", "cell": [8, 14] },
    { "kind": "HOUSE", "cell": [12, 14] },
    { "kind": "FARM", "cell": [9, 16] },
    { "kind": "WORKSHOP", "cell": [11, 16] },
    { "kind": "SPEAR", "cell": [7, 12] },
    { "kind": "SPEAR", "cell": [13, 12] },
    { "kind": "FIRE", "cell": [10, 12] },
    { "kind": "WALL", "cell": [6, 11] },
    { "kind": "WALL", "cell": [8, 11] },
    { "kind": "WALL", "cell": [12, 11] },
    { "kind": "WALL", "cell": [14, 11] },
    { "kind": "WALL", "cell": [9, 10] },
    { "kind": "WALL", "cell": [11, 10] }
  ],
  "starter_units": [
    { "unit": "villager", "cell": [9, 15], "sex": "m" },
    { "unit": "villager", "cell": [10, 15], "sex": "f" },
    { "unit": "villager", "cell": [11, 15], "sex": "m" },
    { "unit": "villager", "cell": [8, 15], "sex": "f" },
    { "unit": "villager", "cell": [12, 15], "sex": "m" }
  ],
  "starter_props": []
}
